start,end,text
1438.278,1442.021,And one of the neat things about doing orbits like this
1442.958,1444.899, is they work in the opposite direction as well.
1445.079,1453.883,"If you want to get from Mars back to Earth, you put yourself in orbit around Mars, and then you slow yourself down."
1454.703,1458.945,And that slowing you down sends you on a path back to Earth.
1459.565,1463.907,Now we've got the some of the landers that have gone from Earth to Mars.
1464.367,1466.388,How do they actually land?
1466.448,1469.109,Or how do they even get into orbit around Mars in the first place?
1469.568,1480.036," Well, once they get to Mars, they're actually not going the right speed to stay there unless they do some maneuvering to change their velocity."
1480.057,1482.158,And we change velocities in a number of different ways.
1482.198,1484.84,One of the really cool ways is through aerobraking.
1485.101,1489.524,And this is where you use an object's atmosphere to slow yourself down.
1489.684,1491.526,"So as you go through the atmosphere,"
1492.256,1501.765," all the particles hitting your spacecraft, slow your spacecraft down, and you can get whatever velocity you need as long as you started with a higher velocity."
1502.045,1508.952,You can also use gravitational assists to speed yourself up if you're going not quite the right speed by going too slowly.
1509.38,1512.322," Well, why don't we talk about the gravitational system in one more second?"
1512.962,1521.687,"But I see with the arrow breaking, it's like you're dipping into the atmosphere, you know, banging into a little bit of the atmosphere, but then you're getting back out again."
1521.707,1523.287,So it's not like you're crashing.
1524.248,1524.468,Right?
1524.508,1531.812,"You're, you're just slowing, you're skimming and you're slowly scraping against the atmosphere, time after time until you're in an orbit."
1532.533,1537.036, It's like watching a water plane do touch-and-goes.
1537.076,1540.818,"They come in, glide across the surface, and then skip back off into the air."
1541.318,1547.121,"Well, in this case, it's a satellite skipping into the atmosphere and then skipping back off after slowing down a little bit."
1547.901,1550.303,And if a planet doesn't have an atmosphere?
1551.663,1553.264,Then it gets a little bit more complicated.
1553.324,1558.227,Then you probably end up having to fire an engine or insert yourself.
1559.047,1560.048,If you insert yourself
1560.566,1565.449," In the opposite direction, instead of gravitational assist, you have gravitational braking."
1566.25,1568.611,It's all about what direction you're going as well.
1569.272,1575.456,"Now we talked about gravitational assist in a question show, but why don't we bring that up again."
1575.476,1585.803,"That's the process where spacecraft use planets to increase their speed so that they can get to, I guess, more distant goals faster."
1586.283,1588.744,"So New Horizons, for example, which is on its way to Pluto."
1589.907,1594.371, did a gravitational assist with Jupiter to increase its velocity.
1594.452,1595.573,So what's the process here?
1595.653,1598.676,"Because as we had in the question show, how is it possible?"
1598.976,1603.901,It makes sense for a spacecraft getting pulled into the gravity well of a planet like Jupiter to speed up.
1604.321,1611.088,"But then as it goes back out of the gravity well, it should slow down the exact same amount just like going down a hill and then coming back up again."
1611.468,1613.349, Let's return to our bicycle analogy.
1613.709,1618.31,Imagine that you're going down a road that has a big dip in it.
1618.55,1622.291,"You're plugging along, you're going a constant thirty miles per hour."
1622.572,1626.193,"That's a little bit insane on a bike, but let's imagine because it's a nice round number."
1626.553,1633.515,"If you have a perfectly symmetric dip where you go down and you come back up and all friction is exactly the same,"
1634.055,1639.119," you're going to accelerate as you go down into that hill, and you're going to slow down as you come back out of that hill."
1639.98,1644.743,"And you should, if you go into it at thirty miles per hour, you should come out of it at thirty miles per hour."
1645.024,1649.247,Now imagine that somehow that dip
1649.947,1651.087, is moving forward.
1651.407,1657.209,"And it's moving forward not quite as fast as you are, but it's still moving forward."
1657.429,1668.891,"As it moves forward, what ends up happening is you end up spending more time going into the dip because the bottom of the dip keeps going forward and it essentially stretches out the downhill part."
1669.652,1673.252,And so you're accelerating downhill for a much longer period of time.
1673.973,1675.493,"But then as you come back out of it,"
1676.755,1678.859, you're spending less time going up the hill.
1678.999,1685.371,"So altogether, you spent more time getting accelerated downhill than you spent getting slowed down going uphill."
1685.832,1688.958,So you end up going faster than that original thirty miles per hour.
1689.75,1689.91, Right.
1689.93,1696.913,"And I think the way we tackled it was that it's true, you know, as you're going to Jupiter, that part does cancel out, you get pulled into Jupiter."
1696.973,1701.755,"And then as you move away from Jupiter, you you slow back down again, because Jupiter is pulling on you."
1701.795,1706.477,"But the point is, is that you match Jupiter's speed in its orbit."
1706.777,1708.397,And that's where the bonus comes from.
1708.997,1712.319,"So it's, it's all about both of you are moving."
1712.639,1715.44,"And if it's moving forward, and you're moving forward"
1715.914,1719.8, It's velocity forward gets helped to add push to you.
1720.0,1727.03,"Now, if you're going in the opposite direction, you end up spending a lot more time getting slowed down than you end up getting sped up."
1727.29,1731.256,So you can use a gravity assist to slow yourself down as well.
1731.456,1732.698,It's all about directions.
1733.214,1748.866," And so that's one of the techniques that they can use to go into orbit around a planet is they'll come in and use successive gravity, reverse gravity assist, gravity brakes to get themselves into orbit."
1749.006,1752.649,And it's all about matching the angles and slowing yourself down.
1753.29,1756.692,"Okay, so the last part of this puzzle then is how do they land?"
1757.553,1761.476,Landing is one of the more complicated things we've had to figure out how to do.
1762.321,1763.063, landing safely.
1763.444,1765.89,"Yes, it's easy to crash things."
1765.95,1767.855,We've been doing that for a long time.
1768.154,1771.437," Well, landing, you have to somehow shed velocity."
1771.657,1773.638,"When you have an atmosphere, it's fairly easy."
1773.678,1777.121,"You go through the atmosphere, and the atmosphere wants to slow you down."
1777.301,1782.205,"It wants to burn you up, actually, but if you avoid the burning up part, it slows you down."
1782.465,1794.655,"Mars, the atmosphere's a little bit thin, so it's usually this crazy combination of, we're going to fire rockets to slow us down, then we're going to launch parachutes to slow us down some more, and let's add some airbags."
1795.205,1796.386, maybe bounce a few times.
1796.786,1802.248,"If you have no atmosphere, like when we land on the moon, there's a lot of rocket firing going on."
1802.449,1813.934,"So just as you can use a rocket to lift you up and take you off of the planet, you can use a smaller rocket to slow you down as you come in for a landing."
1814.935,1815.375,If you've
1816.184,1819.87, ever seen one of those jet packs that they have at like Disney World or something?
1820.511,1827.842,The guy fires the rocket a lot to take up over the magic castle and then the rockets are firing less as he comes in for a landing.
1828.062,1831.327,So they use rockets first to slow themselves down
1831.867,1845.184," and basically put themselves on a ballistic crashing into the surface of the planet, the moon, the object, orbit, and then just before they're getting ready to crash violently, they fire extra rockets to slow them down even more."
1845.725,1847.127,It's very fuel intensive.
1847.387,1849.028," Right, and it's that whole process in reverse."
1849.328,1861.076,"You start out in an orbit, moving very quickly around the object, and then you fire in the opposite direction that you're orbiting, and that drops you out of orbit, down towards the surface, because you're slowing down."
1861.136,1867.94,"You're no longer matching your outbound speed with your inbound speed, so you're starting to slow down."
1868.16,1876.226,"But if you even look at the video of the Apollo landings, you could see the Moon's surface moving under them very quickly, because there's still"
1877.166,1879.087, on an orbit.
1880.327,1885.549,It's not until the very last few thousand meters that they are able to straighten out.
1885.589,1886.85,So they're coming straight down.
1887.31,1890.151,"So they don't, you know, scrape along the surface of the moon."
1890.351,1892.172,Your motion is always an ellipse.
1893.152,1902.218," If you slow yourself down at one point, then you're just moving the other one hundred and eighty degrees around the orbit point closer to the surface."
1902.899,1905.681,"And if you move it close enough to the surface, it's inside the planet."
1906.201,1909.043,And your orbit takes you to the surface of the planet.
1909.622,1915.764," And I guess, to put this all together, spacecraft controllers will use all of these techniques."
1916.204,1928.147,"They will figure out which kind of orbit to launch a spacecraft, they'll be able to use a combination of gravity assists and orbital transfers to move a spacecraft around the Solar System from"
1928.627,1933.752," from planet to planet, or to get speed boosts, or to go past objects that they want to image."
1934.192,1944.241,"And then, if they want to go into orbit, there's a process in reverse, either through gravity breaking, or through firing rockets, or using the atmosphere."
1944.421,1947.404,And every one of these missions are very complicated.
1947.424,1951.848,They have to do a lot of work to figure out all of the mathematics involved.
1952.268,1957.153, And I think the amazing part whenever I see these missions is how close they always get them.
1957.293,1965.361,"It's amazing how, when you think about the enormous distances involved, they're able to get these spacecraft within their tolerances that they were expecting."
1965.501,1966.802,So they get right on target.
1966.822,1967.283,It's great.
1968.163,1974.207, It's really amazing and it all comes down to always carrying a little bit extra fuel just in case you need it.
1974.307,1976.948,"Right, in case you need to make one last correction."
1977.188,1988.454,"Great, okay, well I think that covers, so now you know and understand how spacecraft get off the Earth, into orbit, around the solar system, and land on other worlds."
1988.954,1989.535,"Well thanks, Pamela."
1990.055,1991.176,"It's been my pleasure, Fraser."
1991.196,1992.316,"All right, we'll talk to you next week."
1992.756,1993.617,"Okay, bye-bye."
1995.182,1998.865," This has been AstronomyCast, a weekly, facts-based journey through the cosmos."
1999.686,2003.369,Show notes and transcripts for every episode are available on our website.
2003.889,2006.291,Check it out at AstronomyCast.com.
2007.052,2011.555,"You can send us any comments, questions, or feedback to info at AstronomyCast.com."
2012.016,2013.016,We read every email.
2013.777,2018.501, The show is a non-profit educational resource provided by Fraser Cain and Dr. Pamela Gay.
2019.081,2021.923,We are supported through the kind donations of listeners like you.
2022.704,2025.486,"If you enjoy Astronomy Cast, why not give us a donation?"
2026.187,2028.929,"It helps us pay for bandwidth, transcripts, and show notes."
2029.509,2031.391,Just click the donate link on the website.
2032.231,2034.333,All donations are tax deductible for U.S.
2034.393,2034.953,taxpayers.
2035.794,2037.435," You can support the show for free, too."
2037.936,2039.897,Write a review or recommend it to your friends.
2040.537,2041.398,Every little bit helps.
2042.158,2045.06,Click support the show on our website to see some suggestions.
2045.881,2054.667,"To subscribe to the show, point your podcatching software at astronomycast.com slash podcast dot xml or subscribe directly from iTunes."
2055.367,2057.011, Music is provided by Travis Searle.
2057.492,2059.275,This show was edited by Preston Gibson.
2059.896,2065.608,Astronomy Cast is produced at Southern Illinois University Edwardsville with generous support from Universe Today.
