start,end,text
0.69,7.676," This episode of Astronomy Cast is brought to you by Swinburne Astronomy Online, the world's longest running online astronomy degree program."
8.137,12.861,Visit astronomy.swin.edu.au for more information.
18.291,22.874," Astronomy Cast, Episode Eighty-Four for Monday, April Fourteenth, Two Thousand Eight."
23.495,25.096,Getting Around the Solar System.
25.777,32.602,"Welcome to Astronomy Cast, our weekly facts-based journey through the cosmos, where we help you understand not only what we know, but how we know what we know."
33.142,40.728,"My name is Fraser Cain, I'm the publisher of Universe Today, and with me is Dr. Pamela Gay, a professor at Southern Illinois University, Edwardsville."
41.168,41.628,Hey Pamela.
42.009,43.27,"Hey Fraser, how's it going?"
43.85,44.791,"Good, how's Europe?"
45.852,49.055," I don't know yet, because we're cheating and recording this before I leave."
49.595,50.716,"Oh, this joke never gets old."
53.738,55.72,"So once again, we've booked a bunch in advance."
55.8,58.482,"And so I think, where are you right now, then?"
59.923,65.146,"Right now, I am probably over the Atlantic Ocean on my way home."
65.887,66.167,OK.
66.768,72.432,Then you had a good time at the pub with the mini astronomy cast to meet up in the UK.
72.652,73.513,"Yes, exactly."
74.105,76.547," All right, so let's get on to this week's show."
77.268,82.192,"Now, have you ever wondered what it takes to get a spacecraft off the Earth and into space?"
83.052,84.193,And what are orbits?
84.233,84.874,How does that work?
84.894,87.516,What's the difference between a polar and an equatorial orbit?
87.916,93.961,And how do managers at NASA actually navigate a spacecraft to another planet half a solar system away?
94.482,96.023,And how does it use gravity assists?
97.244,99.886,And how do they get the spacecraft into orbit around another planet?
100.046,100.747,And how do they land?
101.44,103.041," All right, so many questions."
103.301,103.541,Okay.
104.462,115.008,"So let's so this week, the plan is, we're going to talk about every way that spacecraft get from the Earth out into space, and do their job."
115.668,117.129,So let's bring it right back home.
117.43,123.113,And let's start with what are the mechanics of actually getting something off of the Earth?
123.763,127.285," Well, you need to actually fire more than just once."
127.585,137.731,There's this fascinating notion that if you give a rocket a big enough burst of energy that it will fly off into space and happily orbit.
138.532,149.579,"But when you look at what NASA rockets actually do, they fire and fire and fire and fire and fire and fire and fire and keep firing and the rocket makes it into space and they keep firing and the rocket's in space and then they shut off."
151.2,151.36,And
152.341,155.284, to our network television-trained mind.
155.564,166.953,"It looks like the rocket takes off perpendicular to the Earth, flies straight into space, and the engines turn off, and as soon as they turn off, the rocket starts going around the planet."
167.213,168.815,And that's not actually what happens.
169.537,178.881, you actually take off and you fling yourself in the direction of the Earth's rotation.
179.662,192.767,"So you're adding your velocity to the velocity that you already get from the planet's motion, and you take off such that you're heading on an arc into space."
194.389,207.59," you angle yourself such that once you get about where you want to be, you fire the rockets so that your orbit starts you going in roughly a circle around the planet."
208.663,209.464, I think that's a misnomer.
209.484,214.467,"As you said, people imagine a rocket ship taking off and going straight up and out into space."
214.967,216.168,And that never happens.
216.308,222.312,The rocket takes off and almost immediately starts to angle itself downrange.
224.694,233.625," so that it's almost aiming, so it's almost flying parallel to the Earth's surface, and going faster and faster and faster and getting higher and higher altitude."
234.026,244.018,"But in the end, it's, it's more that the rocket is going parallel to the Earth at at the thousand kilometers per hour, not straight up at the thousand kilometers per hour."
244.358,256.986," And this is why with the space tourists, with those flights, like the one with the Spaceship One, which went up to a hundred kilometers and came back down, it went straight up."
258.155,261.156, reached the limits of space and then came back down.
261.556,263.917,"And people said, Oh, well, then we're really close to getting into orbit."
263.937,274.16,"But in fact, it's a tremendously different amount of, of energy and velocity required to be going at thousand kilometers sideways around the earth."
274.881,287.345,"And the fact is that if we didn't have that extra firing that extra maneuver, once you get up to the top of your arc, that sets you going sideways, then you just fall straight back down."
288.45,294.492," Orbits are shaped like ellipses, and they're perfectly happy to have one end of that ellipse hit the planet."
295.492,316.537,"And to take an orbit and make it from one that goes up past the top of the atmosphere and comes back down and crashes onto the planet, you have to fire the engines up at the top of the arc, up at the top of the atmosphere, beyond the atmosphere, and set you moving sideways."
317.785,327.527," And it's that extra step, that firing at the top, that allows you to keep going in a circle around the planet instead of returning back to the surface more violently than you might have wished for."
328.207,333.648,Now the other thing you mentioned was the fact that the rocket is thrusting and thrusting and thrusting.
334.068,337.369,And why don't they just put one great big boom and get out into space?
337.709,340.29,Well that might be a bit devastating for the astronauts.
341.45,346.311,It comes down to how much acceleration can any one thing handle.
347.21,365.302," If I wanted to, I could, and I had the technology, which I don't think we have right now, but if I wanted to, and we did have the technology, I could accelerate a rocket over the course of perhaps thirty thousand feet such that it had all the velocity it needed to get to orbit."
365.322,376.669,"It would still have to do an extra firing once it got up to the correct altitude to get it going sideways, but I could get it going fast enough that it would get to that highest point, but I'd have to accelerate so fast"
377.315,382.857, that it would shake the tar out of the spacecraft and probably kill the astronauts by accelerating too fast.
383.237,395.04,"Well, that's what happens when a spacecraft is coming back through the atmosphere, it's crashing into the it's hitting this the solid atmosphere at huge velocity, and it's heating up."
395.36,403.322,"So if you were actually to try and accelerate it to that speed right away, I'm sure you would just vaporize it in the atmosphere, it would be bad."
403.622,406.623,"So instead, we do constant acceleration,"
407.846,409.878," And by firing constantly, you..."
411.283,416.805, don't have to get going to a velocity that will carry you through the atmosphere.
416.885,419.106,You can keep pushing yourself through the atmosphere.
419.847,428.69,"One way to think of this is if you've ever ridden a bike, you can get your bike going down the hill so fast that you don't have to pedal up the next hill."
429.351,435.313,But you might have to get yourself going so fast that you're a bit scared of what might happen if you hit a rock.
436.113,439.295,"But if instead you go down that first hill a little bit more slowly,"
439.855,445.24, you can pedal up the next hill and you never have to get going as fast and you'll still get to the top of the next hill.
446.2,462.754,"If we gave the rocket enough energy close to the planet Earth to carry it all the way up through the atmosphere, it would have to be going frighteningly fast and it would slow down and slow down and slow down as it goes through the atmosphere and encounters drag until it eventually pops out in orbit."
463.815,468.899,"By instead accelerating all the way through the atmosphere, it's just a little bit friendlier to everyone."
469.318,480.566," And so with that rocket that's firing constantly, the bulk of the energy that's coming out of the back of the rocket is just counteracting its pull back from the force of gravity."
481.126,488.031,"You know, if you take the amount of energy required to hold the rocket steady in air, in mid-air,"
489.352,492.134, that would be most of the energy that's coming out of the back of the rocket.
492.154,495.476,And then you're left with just a little bit of extra force.
495.576,496.957,And that's what pushes it up.
497.017,504.342,"And as the rocket is going faster and faster and faster, more and more of that of that energy that's coming out of the rocket is used to accelerate it."
504.662,516.33,"And that's why when you see like the space shuttle, or especially with the old the Saturn five, sitting on the pad, when they first turn it on, it barely seems to move and then it slowly inches up."
516.71,518.792,"But later on, it's going faster and faster."
519.712,520.393, much faster.
521.314,533.803,"The acceleration is increasing, so... Well, and one of the other things that's happening is you start off and the poor, innocent engines have to not only pick up the spacecraft, but they have to pick up all of the fuel."
534.484,537.246,"And the higher up you get, the less fuel you're trying to move."
538.132,543.698," And so you're firing engines to move smaller and smaller masses as you go, and that helps as well."
544.559,548.083,And all these things build together to allow us to get things into orbit.
549.024,552.548,"And once we're up there, we fire again so that we stay in orbit."
552.868,554.37,"Okay, so let's talk about some orbits then."
554.47,558.875,So what are the different kinds of orbits that a spacecraft might want to get into?
560.009,568.255," Well, the most common orbit for human beings is your standard run-of-the-mill low Earth kind of sort of equatorial orbit."
569.035,576.1,"These are orbits that pass over Cape Canaveral, that pass over the Soviet launch facilities."
577.211,585.374," And they're inclined to the equator, but most of the time, the International Space Station and the space shuttle stay over."
586.255,587.795,Hubble is there.
587.915,588.656,And Hubble too.
589.616,599.12,"They're staying over the equator, they're crisscrossing, they're passing over Florida, they're passing over mid-America, they're passing over the plains of Russia."
603.041,612.251," And these are just nice happy little orbits about three hundred miles up that take about ninety minutes, hundred minutes to go round and round and round."
612.912,619.939,And what's neat about these inclined orbits is every orbit they pass over a slightly different part of the planet.
620.54,622.783,So you have an orbit and you can imagine
623.982,631.026," a hula hoop going around the planet where it crosses the equator in two places, and then it has a high point and a low point."
631.587,643.174,"Well, as the Earth rotates inside that hula hoop, and in fact, as the hula hoop itself slowly rotates, that high point is over a different point on the planet every moment."
643.874,652.82,"And that allows different parts of the planet to have the International Space Station straight overhead at different times, which is cool for amateur observers who like to go out and look at these things."
653.186,657.709," Now you mentioned that, you know, a lot of stuff launches near the equator."
657.729,661.192,They get a boost from the rotation of the planet there?
662.053,663.574,That's exactly correct.
663.734,669.538,"Depending on where you are on the planet, you're going around the center of the planet at a slightly different speed."
670.219,675.383,The entire surface of the planet rotates once every twenty-four hours relative to the Sun.
676.363,682.448,"And if you're at the equator, you have to travel a much larger distance than you have to travel if you're up near the pole."
683.424,691.949," Well, that extra velocity that you have by being near the equator helps throw you into orbit and gives you an extra boost as you're taking off."
692.069,703.335,"So Florida is a great place, if you want to stay in the continental United States, to stick a space facility because it's pretty much as close to the equator as you can get in our country."
703.663,705.624," Well, I think Sea Launch has the best one."
706.405,715.571,"They take a boat and an oil rig down to the equator in the ocean, and then they launch rockets right from the equator."
716.252,718.653,"Now, let's compare that with the polar orbits."
718.673,719.334,How is that different?
720.165,737.111," Well, with a polar orbit, you launch yourself into space, and not only when you get into orbit do you give yourself a boost sideways to get yourself staying in orbit around the planet, but you also do an extra transfer so that you're going over the North Pole and over the South Pole."
737.631,740.392,And there's a lot of different reasons to do this.
741.109,742.811, different type of orbit.
743.011,755.787,"First of all, with a polar orbit you're constantly passing over different parts of the planet and so this allows you to slowly map the entire surface of the planet as you go around and as"
756.267,758.929, the planet rotates beneath it.
759.009,760.951,You can still have a low Earth orbit.
762.051,770.217,"In general, we don't have orbits that go exactly over the North Pole and exactly over the South Pole, just because that starts to get a little bit complicated."
770.898,773.099,Our Earth isn't actually a perfect sphere.
773.179,774.56,"We wish it was, but it's not."
775.601,779.204, It's rotation causes it to bulge out a little bit at the equator.
779.744,780.945,And this affects orbits.
781.246,786.63,And it's just a little bit simpler to have something that's tilted slightly relative to north and south.
787.47,793.855,It tends to get tilted naturally by this extra torque from going over the equatorial bulge.
794.135,799.059,"But you don't get the gravity, you don't get the boost from the Earth's equator, right?"
799.139,802.402,"In this case, you just have to get into space all on your own."
803.859,814.97," Well, once you're in space, you can get the extra boost to get into space from launching near the equator, but then you have to tilt your orbit once you're up there."
815.05,819.934,You have to change the direction that you're moving forward.
820.315,821.316,Think of it as
821.96,828.401, You get your car moving and then you break the front left wheel.
829.221,832.722,Now there's no way in a healthy car to break only the front left wheel.
833.282,841.283,"But you can imagine in an unhealthy car that if you break only the front left wheel, it's going to cause the entire car to keep moving but change direction."
842.764,847.385,"Well, you get that extra velocity, you get that motion by launching at the equator."
848.025,850.045,"And then once you're in orbit,"
850.612,858.994, you either break or you accelerate to tilt the direction that you're headed in until you get going in the polar orbit that you want.
860.154,863.774,"All right, and I guess the last orbit that really matters is a geosynchronous orbit."
864.235,867.275,"So with a geosynchronous orbit, you're up really high."
867.315,872.276,You're actually up thirty five thousand nine hundred and seventy kilometers.
873.396,877.337,"At this altitude, you are orbiting"
877.907,881.51," Instead of every ninety minutes, you're orbiting every twenty-four hours."
881.971,888.897,And what's cool with this type of an orbit is you stay over the exact same part of the planet all the time.
889.458,895.263,This is useful if you're a television station because you can stay over the people that you're trying to communicate with.
895.623,902.79,It's useful if you're a weather satellite that's tied to a specific part of the country because you stay over the part of the country you're trying to take
903.43,906.152, images up that you're trying to keep track of.
906.392,908.214,"Well, is there going to be a tornado?"
909.615,923.164,"So geosynchronous orbits, these are one of the most prized orbits for communication satellites and weather satellites, and we're actually running out of space to put things in geosynchronous orbit because it's one of the first places to fill up."
924.124,927.727,Now one of the problems with geosynchronous is you're so high up that
928.283,930.805, that you can't take detailed surface images.
930.925,939.072,"So if we really want to do like Google Maps style images, that is what's called a sun synchronous orbit, but we'll get to that one in a minute."
940.153,947.499,The other problem with geosynchronous orbits is you have to stay above the equator if you want to stay over the same part of the planet.
948.319,954.865,"If you go up to thirty five thousand nine hundred seventy kilometers and you get there such that you're over Boston,"
955.612,963.558," Well, you're going to be over Boston on one part of your orbit, and then you're going to cross down over the equator, and then you're going to end up over the southern hemisphere somewhere."
964.279,975.208,"You're still orbiting every twenty-four hours, but because your orbit is inclined, where you are on a north-south line, that's going to change constantly."
976.269,982.974,"And so it's like you're tracing this line up and down the same part of the planet on the globe, but"
983.769,985.69, that's not always useful.
985.83,987.511,"In fact, it's rarely useful."
988.312,1000.779,"And if you're a poor individual living in Northern Canada, in Siberia, in Norway, in Finland, and you need a communications satellite, you can't see one over the equator real well."
1001.899,1004.641,So another type of orbit that we use is
1005.806,1007.927, and I may be pronouncing that wrong.
1007.988,1019.298,It's a Russian word because the Soviets were the ones who had to come up with this orbit because most of their country is far enough north that geosynchronous communication satellites aren't useful to them.
1020.218,1028.646,So modification on the geosynchronous orbit is this orbit that for half the orbit when it's at its furthest point from the planet
1029.306,1032.807, is going along at the same rate as a geosynchronous satellite.
1032.827,1045.771,"So it's basically staying over the same part of the planet, staying over the same part of the planet, and then it accelerates, and then it zips really close into the planet over a different point, zips back out, and lands over where it started originally."
1046.011,1056.754,"So with this modification of a geosynchronous, one that is inclined sixty-three point four degrees, so it's getting up to the high northern or high southern latitudes,"
1057.689,1065.09," You have a twelve hour orbital period, but for most of that twelve hours, it stays over the exact same point in the globe."
1065.771,1082.954,"What's cool is if you have three satellites in this orbit, one of them, if you space them out correctly, will always be over the part of the planet you're interested in communicating with, so you can provide cell phone signals, you can provide television, you can provide weather imaging for people who live up near the poles."
1084.454,1086.795," As we said, we're talking about getting around the solar system."
1086.875,1092.898,"So let's say we've launched some kind of robotic explorer that's going to go to the moon, for example."
1093.898,1094.338,"No, you know what?"
1094.358,1095.399,Let's go with the most complicated.
1095.419,1096.299,Let's go with Messenger.
1096.319,1098.88,You really don't like me.
1099.52,1102.381,"Yeah, which is the mission to Mercury."
1102.602,1105.163,It launched from Earth.
1105.203,1107.163,I assume it went into an orbit around the Earth.
1107.384,1108.344,And then what?
1108.564,1111.825," Well, it didn't do what we had originally planned."
1112.485,1120.848,"One of the problems with really complicated orbits is you have to figure out, OK, if this planet is here and this planet is here and this planet is here, we can use these gravities."
1120.908,1124.329,And it's like playing a really complicated game of pool.
1124.889,1130.571,"As long as everything's in the right place, everything ricochets correctly, you end up getting all the balls in the holes."
1131.331,1136.073,"But if one thing isn't where you expect it to be, you have to choose an entirely different shot."
1136.733,1139.416," Well, with MESSENGER, they missed the intended launch window."
1140.216,1150.266,"So they ended up launching, and they went into this orbit that carried this satellite that was destined for Mercury out past the Earth's orbit."
1151.095,1156.561, So it took off and it headed on an elliptical orbit that carried it beyond where the Earth would ever go.
1157.121,1158.663,And then it got out there and went too far.
1158.823,1162.087,And then it came back in and it came inside Earth's orbit.
1162.287,1173.579,"And then it ended up encountering the Earth again, spiraling, slowing down, took some images of the Earth, and then spiraled in towards the Sun after doing some braking maneuvers."
1174.625,1182.671," went past Venus, went out past Venus's orbit, came back in, and then it spiraled in."
1182.871,1189.076,"And it's this weird circles getting smaller and smaller and smaller, but never really being circles."
1189.156,1201.266,"They're ellipses, and the entire system rotates and shrinks, rotates and shrinks, rotates and shrinks, as it spirals in, getting braked by different planets, taking images as it goes."
1202.58,1215.805," And in this complex, spiraling set of shrinking ellipses, they ended up adding two years to how long it took to get to Mercury, all because the planets weren't properly aligned."
1215.825,1217.826,"Okay, I think that was too complicated."
1218.166,1218.446,Yes.
1218.686,1221.468,So let's pick a simpler example.
1222.088,1227.51,"Okay, so let's say that we're going to go from Earth to Mars."
1228.11,1228.33,Yes.
1228.63,1229.771,How does that work?
1230.697,1248.613," That's actually one of the coolest orbits because you time it just right so that when you look at a picture of the system, where Earth is when the mission takes off is exactly across the sun from where Mars is when the mission gets there."
1248.813,1253.638,So what you do is you take a satellite and you put it in an elliptical orbit
1254.295,1264.719," where the point where the object is closest to the Sun is where the Earth is located, and the point where the object is furthest from the Sun is where Mars is located."
1265.159,1272.241,"It's a nice, friendly, low-energy type of transfer called a Hohmann transfer, low-energy maneuver."
1272.722,1273.762,"The way orbits work,"
1274.292,1281.916," When you're closest to whatever the primary mass in the system is, in this case the sun, you're moving the fastest."
1282.257,1284.958,"When you're furthest from that object, you're going the slowest."
1285.639,1289.761,"When you're on a circular orbit, you stay at the same velocity all the time."
1290.081,1293.363,"When you're on an elliptical orbit, velocities are constantly changing."
1293.643,1296.625,And you can have orbits that cross
1297.335,1301.956," the Earth and Mars orbit, you can have orbits across Earth and Jupiter's orbit."
1302.236,1311.158,"And the easiest way to get yourself from one orbit to another is to put yourself first in a nice, friendly, circular orbit around, say, Earth."
1311.998,1319.38,"And then when you're pointed in the right direction, you fire your engines so that you're going the velocity that's necessary"
1320.123,1324.788, to be on the elliptical orbit that intersects the orbit of whatever you're trying to get to.
1324.988,1334.518,Now the trick is timing this just right so that the object you're trying to get to is at that point in its orbit when you get to its orbit.
1335.64,1347.791," I've seen animations of this, and you see the spacecraft leave Earth, leave the Earth orbit and move into that elliptical orbit, and it doesn't look like it's going to get to Mars at all."
1348.532,1356.939,"But then the, I guess the orbit of Earth with the spacecraft catches up to the orbit of Mars and it's a bullseye."
1357.705,1360.567, And this is where launch windows are so important.
1360.647,1365.729,"If you miss a launch window, you really can't catch back up to the planet."
1366.79,1368.911,It ends up requiring far too much energy.
1369.331,1376.715,So we have this narrow window of time when the Earth is exactly where it needs to be to get to Mars when it's where it needs to be in its orbit.
1377.015,1383.679,"And as with all orbital transfers, it's all about saying, okay, let me change my velocity"
1384.178,1388.908, perpendicular to what I'm going around now to get to what I want to be going around later.
1389.542,1393.523," Now, you mentioned that this is a low energy orbit."
1394.083,1399.664,So this is the way to get from Earth to Mars with the least amount of energy.
1400.524,1411.707,"I mean, I'm guessing that if you just wanted to fire your thrusters nonstop, or you had some kind of really powerful nuclear rocket, you could get there in more of a straight line."
1411.747,1416.248,You could just sort of put Mars in your crosshairs and keep firing and you'd get there.
1416.601,1418.803, That would require a lot of energy.
1419.043,1420.124,"Right, and a shorter time."
1420.224,1431.393,"And so I guess the payoff or the balance is that with the low energy transfer, it's the lowest amount of energy required to get from Earth to Mars."
1431.853,1438.158,"There are higher energy orbits you could use, but those might be not even possible or too expensive."
